File Name,Dimensions,File Size (MB),Aspect Ratio,Vision Response,Vision Tokens
@mensweardog3.jpg,"(1477, 1477)",0.2030544281005859,1.0,"Based on the image provided, the dog appears to resemble the following breeds:

1. Shiba Inu: The size, erect ears, and facial structure are characteristic of a Shiba Inu.

2. Akita: While the size is not completely clear, some features, like the shape of the face and the coloring, can be found in an Akita, although Akitas are typically larger dogs.

3. Jindo: The dog could be a Jindo, which is a breed that often shares similar physical characteristics with the Shiba Inu and Akita, including a proportionate face and pointed ears.

The dog's coat color, creamy and with hints of orange/tan, is common in these breeds, particularly the Shiba Inu. Keep in mind that without pedigree information, breed identification based on appearance alone can be imprecise.","{'prompt_tokens': 111, 'completion_tokens': 173, 'total_tokens': 284}"
@mensweardog4.jpg,"(1073, 1200)",0.2012033462524414,0.8941666666666667,"That dog looks like a Shiba Inu. It has the characteristic pointed ears, upright posture, and a foxy face which are typical of the breed. Shiba Inus have a distinctive appearance that is not commonly confused with many other breeds, but if I were to guess other potential breeds based solely on size and some common features, the following could be considered:

1. Akita Inu: Although larger and more robust than Shiba Inus, they share a similar Spitz-type appearance.
2. Finnish Spitz: Known for their fox-like features and pointed ears, similar to Shiba Inus.
3. Jindo: A breed from Korea with similar size and pointed ears, although their temperament and other physical traits may differ.

However, it's important to note that the example provided in the image strongly resembles a Shiba Inu, which is a distinct breed with specific characteristics.","{'prompt_tokens': 111, 'completion_tokens': 181, 'total_tokens': 292}"
@mensweardog5.jpg,"(1280, 1280)",0.1681337356567382,1.0,"Based on the image provided, the dog appears to be a Shiba Inu. Its facial structure, erect ears, and coat color are characteristic of this Japanese breed known for its fox-like appearance.

However, if we were to consider other breeds that might share some similar visual traits (although this dog clearly looks like a Shiba Inu), two other possibilities might include:

1. Akita Inu - Another breed from Japan that is larger than the Shiba Inu but shares some coat and facial characteristics.
2. Jindo - A Korean breed with similar spitz-type features, such as pointed ears and a dense coat.

Remember that visual identification may not be entirely accurate, and dogs of similar appearance might be mixed breeds or less common breeds not immediately recognizable.","{'prompt_tokens': 111, 'completion_tokens': 154, 'total_tokens': 265}"
@mensweardog6.jpg,"(634, 626)",0.0587720870971679,1.012779552715655,"The dog in the image appears to be a Shiba Inu, which is a small-to-medium breed from Japan known for its fox-like appearance and alert expression. However, if considering other possible breeds, it could also resemble:

1. Akita - A larger Japanese breed which can have a similar facial structure and coat color, but is typically bigger in size than a Shiba Inu.
2. Jindo - A Korean breed that may have similar physical traits such as the pointed ears and coat color, but they often have a different body structure.
3. Finnish Spitz - This breed has a similar foxy face and erect ears, and could occasionally be confused with a Shiba Inu, although the Finnish Spitz typically has a more ruffled coat and a different tail set.

Please note, based on this image, the most likely breed is the Shiba Inu.","{'prompt_tokens': 111, 'completion_tokens': 178, 'total_tokens': 289}"
@mensweardog7.jpg,"(400, 400)",0.0158929824829101,1.0,"That dog appears to be a Shiba Inu. It has the breed's characteristic traits such as the upright ears, the fox-like face, and the thick fur. Shiba Inus are a Japanese breed known for their spirited personality, agility, and good nature. Although I only need to provide one potential breed, since the breed is quite discernible in this case, if I were to consider similar breeds for the sake of providing three options, I might also suggest:

1. Shiba Inu
2. Akita Inu (although they are larger and have a slightly different build)
3. Finnish Spitz (which has similar coloration and facial features but is typically more slender and taller)

However, based on the image, the Shiba Inu seems to be the most accurate breed identification.","{'prompt_tokens': 111, 'completion_tokens': 163, 'total_tokens': 274}"
