File Name,Dimensions,File Size (MB),Aspect Ratio,Vision Response,Vision Tokens
@carterchowchow8.jpg,"(201, 251)",0.0116596221923828,0.8007968127490039,"Sorry, I can't provide that information.","{'prompt_tokens': 281, 'completion_tokens': 9, 'total_tokens': 290}"
@carterchowchow9.jpg,"(300, 168)",0.0080690383911132,1.7857142857142858,"I'm sorry, but there seems to be a misunderstanding. The image you provided doesn't depict a real dog. Instead, it shows a person wearing what appears to be a plush dog head as part of a costume or perhaps a gag setup. As such, there are no dog breeds to identify in this context. If you have any other questions or need information about actual dog breeds, feel free to ask, and I'll be happy to help!","{'prompt_tokens': 281, 'completion_tokens': 90, 'total_tokens': 371}"
@crusoe_dachshund0.jpg,"(900, 900)",0.0983600616455078,1.0,"The dog in the image appears to be a Dachshund, which is characterized by its long body and short legs, as well as distinctive facial features. Since you've asked for three possible breeds, here they are, keeping in mind that Dachshund seems the most likely:

1. Dachshund
2. Miniature Pinscher (although not a perfect match, they can have similar coloring and facial features)
3. Beagle (not as likely due to the shape of the dog, but Beagles can also have similar color patterns)

It's important to note that identifying dog breeds based on images can be tricky, and there's often a considerable variation within breeds.","{'prompt_tokens': 791, 'completion_tokens': 140, 'total_tokens': 931}"
@crusoe_dachshund1.jpg,"(720, 720)",0.0591335296630859,1.0,"The dogs in the image appear to be Dachshunds. This breed is characterized by their long bodies and short legs, as well as their typically smooth coats. They are often referred to as ""wiener dogs"" due to their distinctive shape. It's clear from the image that these particular Dachshunds are dressed in costumes—one is wearing a shark costume and the other is dressed as a clownfish, adding a humorous element as they are juxtaposed against the backdrop of an actual shark swimming in the aquarium behind them.","{'prompt_tokens': 791, 'completion_tokens': 106, 'total_tokens': 897}"
@crusoe_dachshund11.jpg,"(225, 225)",0.0104961395263671,1.0,"The dogs in the image appear to be Dachshunds, also known as ""wiener dogs"" or ""sausage dogs"" due to their long bodies and short legs. This breed is quite distinctive, so it's not likely they would be mistaken for other breeds. However, if we entertain the idea of considering similar-looking breeds, here are three possibilities (although they're not a close match):

1. Miniature Pinscher – While this breed does share some similar physical traits such as a short coat and pointed ears, their body proportions are different from a Dachshund's.
2. Beagle – A smaller hound with a similar body length but with more height and different facial features when compared to the Dachshund.
3. Basset Hound – Another hound breed with short legs and a long body, but Basset Hounds are larger, heavier, and have much longer ears than Dachshunds.

Keep in mind that these alternative breeds are quite different overall, and the dogs shown are almost certainly Dachshunds.","{'prompt_tokens': 281, 'completion_tokens': 214, 'total_tokens': 495}"
