File Name,Dimensions,File Size (MB),Aspect Ratio,Vision Response,Vision Tokens
@frankietothemoon6.jpg,"(553, 91)",0.0132608413696289,6.076923076923077,"Unfortunately, I can't assist with that request.","{'prompt_tokens': 451, 'completion_tokens': 10, 'total_tokens': 461}"
@frankietothemoon7.jpg,"(201, 251)",0.0092697143554687,0.8007968127490039,"The dog in the image appears to be an Australian Shepherd, which is recognized by its multicolored coat, often with merle (mottled) patterns, and bright, expressive eyes that can sometimes be different colors. Australian Shepherds are known for their intelligence and are commonly used as herding dogs.  

While it is most likely an Australian Shepherd based on the visual information, without a clear pedigree or DNA test, there can always be a possibility of mixed breed heritage. Other breeds with similar features can include Border Collies and English Shepherds, although the distinct merle pattern and coloration are less commonly seen in these breeds compared to Australian Shepherds.","{'prompt_tokens': 281, 'completion_tokens': 136, 'total_tokens': 417}"
@frankietothemoon8.jpg,"(900, 900)",0.0714406967163086,1.0,"Based on the visual characteristics of the dog in the image, the following three breeds may be considered:

1. Australian Shepherd: The dog has the distinctive merle coat and bright blue eyes that are common in the breed. They are known for their colorful coat and variable eye color.

2. Border Collie: While the blue eyes are less common in Border Collies, they can exhibit a variety of coat colors and patterns, including merle, which might be suggested by the pattern in the dog's fur.

3. Miniature American Shepherd: This is a smaller version of the Australian Shepherd and can have similar coat patterns and eye colors.

Keep in mind that without further information, it's not possible to determine the breed definitively, and there's always the possibility of mixed breeds that might display characteristics similar to multiple breeds.","{'prompt_tokens': 791, 'completion_tokens': 165, 'total_tokens': 956}"
@frankietothemoon9.jpg,"(1280, 720)",0.0733890533447265,1.7777777777777777,"The dog in the image appears to be an Australian Shepherd, which is identifiable by its distinctive coat pattern and eye coloring. It's not always possible to be absolutely certain about a dog's breed just from a photograph, as individual characteristics can vary and some dogs may be mixed breeds. However, if I were to suggest three possible breeds based on common characteristics, I would guess:

1. Australian Shepherd - due to the merle coat pattern and overall appearance.
2. Border Collie - they can sometimes have similar coat patterns and facial markings.
3. Shetland Sheepdog - although typically smaller, they can have similar coloration and fur texture.

Keep in mind that without genetic testing or confirmation from the owner, breed identification based on appearance alone is an educated guess.","{'prompt_tokens': 1131, 'completion_tokens': 154, 'total_tokens': 1285}"
@goldenunicornrae0.jpg,"(300, 168)",0.0096435546875,1.7857142857142858,"Based on the image provided, it's difficult to identify the dog's breed with complete certainty. However, I can offer some guesses based on its visible characteristics:

1. Golden Retriever - The dog's fur color and texture could suggest that it may have some Golden Retriever heritage.
2. Shetland Sheepdog - The shape of the ears and the fur around the face give a resemblance to a Shetland Sheepdog or ""Sheltie.""
3. Australian Shepherd - The face and ears also have some similarity to an Australian Shepherd, particularly if the dog has merle coloring not visible in this image.

Remember, this dog could also be a mix of multiple breeds, making it harder to pinpoint specific breed characteristics.","{'prompt_tokens': 281, 'completion_tokens': 148, 'total_tokens': 429}"
