File Name,Dimensions,File Size (MB),Aspect Ratio,Vision Response,Vision Tokens
@mensweardog8.jpg,"(1425, 1425)",0.2933359146118164,1.0,"The dog in the image appears to be a Shiba Inu. This breed is recognizable by its fox-like face, erect ears, and agile build. However, if I were to speculate similar breeds based on the appearance, I might consider the following:

1. Akita Inu – A larger breed than the Shiba Inu, they share a similar spitz-type appearance with a fluffy double coat and curled tail.
2. Jindo – A breed originating from Korea, Jindos have a similar look to Shiba Inus with pointed ears and a similar facial structure.
3. Finnish Spitz – They also have a fox-like appearance with a double coat and pointed ears, although they typically have a redder coat.

Nonetheless, the most accurate breed that the dog resembles in the provided image is the Shiba Inu.","{'prompt_tokens': 791, 'completion_tokens': 169, 'total_tokens': 960}"
@mensweardog9.jpg,"(1648, 1649)",0.5698909759521484,0.9993935718617344,"The dog in the image appears to be a Shiba Inu, which is a Japanese breed known for its fox-like appearance and upright ears. For the sake of providing three possible breeds as per your request:

1. Shiba Inu
2. Akita Inu (though this dog looks smaller than what is typical for an Akita)
3. Jindo Dog (a breed from Korea with similar physical traits to the Shiba Inu)

However, based on the physical characteristics visible in the image, the most likely breed of this dog is the Shiba Inu.","{'prompt_tokens': 791, 'completion_tokens': 117, 'total_tokens': 908}"
@norbertthedog0.jpg,"(2424, 1617)",0.5209999084472656,1.4990723562152133,"Based on the image, the dog appears to be a small, fluffy breed with a somewhat lengthy coat. Here are three possible breeds the dog could be based on its appearance, although without a professional assessment I cannot be certain:

1. Maltese — They often have a long, silky white coat and a similar facial structure to the dog in the picture.
2. Bichon Frise — They have a fluffy, curly white coat that can look similar to the dog's coat in the image when not groomed into the tight curls often associated with the breed.
3. Havanese — Similar in size and with a long, silky coat, though they can come in a variety of colors, including white like the dog in the photo.

It is also possible that the dog is a mixed breed incorporating elements from any of these breeds or similar toy or small breed dogs. Keep in mind that dog breeds can exhibit a wide range of appearances based on factors like grooming, lineage, and age.","{'prompt_tokens': 1131, 'completion_tokens': 200, 'total_tokens': 1331}"
@norbertthedog1.jpg,"(500, 500)",0.0305452346801757,1.0,"The dog in the image appears to be a small, fluffy breed with a distinct facial structure. Considering its characteristics, here are three possible breeds that the dog could be:

1. Maltese - The dog's white, silky coat and facial features could suggest it is a Maltese or has Maltese heritage.
2. Shih Tzu - The dog also resembles a Shih Tzu, especially with the round, dark eyes and the shape of the muzzle.
3. Bichon Frise - The fur texture and overall appearance could indicate that the dog has some Bichon Frise in its lineage.

Without a definitive pedigree, it's hard to say for certain which breed the dog is, and it's also possible that the dog could be a mix of different small breeds that share these characteristics.","{'prompt_tokens': 281, 'completion_tokens': 165, 'total_tokens': 446}"
@norbertthedog10.jpg,"(900, 900)",0.0849113464355468,1.0,"It appears that there has been a misunderstanding. The image you have provided features two dogs, and one of them seems to be a real dog, while the other looks like a plush toy designed to resemble a dog. The real dog in the image appears to be a small, fluffy breed with certain characteristics that resemble those of a Pomeranian, a Bichon Frise, or a Maltese. These breeds are known for their fluffy coats and are often white, though it's important to note that without a definitive assessment, it's challenging to accurately determine the dog's breed solely from an image.","{'prompt_tokens': 791, 'completion_tokens': 122, 'total_tokens': 913}"
