File Name,Dimensions,File Size (MB),Aspect Ratio,Vision Response,Vision Tokens
@emmatheminifrenchie3.jpg,"(768, 960)",0.0776653289794921,0.8,"The dog in the image appears to be a French Bulldog, characterized by its bat-like ears, short snout, and stocky build. While I can provide a likely breed based on the visual characteristics, there is no certainty without genetic testing. Other breeds with some similar features could include:

1. Boston Terrier – They also have a short snout and upright ears but tend to have a tuxedo-like black-and-white coat pattern, which is not visible here.
2. Pug – Pugs have a similar short muzzle and stocky body, but they have distinctive curly tails and not the bat-like ears.
3. English Bulldog – English Bulldogs have a similar stout build and short snout, but they tend to be larger with a more wrinkled face and a different ear shape.

However, based on the image, the most likely identification is a French Bulldog.","{'prompt_tokens': 791, 'completion_tokens': 179, 'total_tokens': 970}"
@emmatheminifrenchie4.jpg,"(2048, 2048)",0.2888059616088867,1.0,"Sure, based on the image provided, the dog appears to be a French Bulldog. This breed is characterized by its small stature, bat-like ears, and heavy, wrinkled head. Here are three breeds that the dog could potentially be, considering its visible characteristics:

1. French Bulldog: The dog's compact build, bat-like ears, and flat face are classic traits of the French Bulldog.
2. Boston Terrier: This breed also shares some physical traits, such as the square head and short snout; however, they usually have a more pronounced tuxedo pattern on their coat.
3. English Bulldog: They have a similar stocky build and wrinkled face, but they are generally larger and have a more pronounced underbite and more excessive skin folds.

Based on the image alone, the closest match would likely be a French Bulldog.","{'prompt_tokens': 791, 'completion_tokens': 175, 'total_tokens': 966}"
@emmatheminifrenchie5.jpg,"(768, 960)",0.090066909790039,0.8,"Based on the appearance of the dog in the image, with its distinct features such as bat-like ears, short nose, and stocky build, here are three possible breeds the dog might be:

1. French Bulldog - The most likely breed given the characteristic facial structure and expressive ears.
2. Boston Terrier - Although this dog does not have the typical tuxedo markings, some Boston Terriers can have similar facial features.
3. Pug - While the dog in the picture doesn't have the typical features of a Pug, such as a tightly curled tail and wrinkles, sometimes mixed breeds can have a varied appearance that might resemble other breeds to some extent.

Given the specific traits seen in the photo, the French Bulldog is the most probable breed.","{'prompt_tokens': 791, 'completion_tokens': 154, 'total_tokens': 945}"
@emmatheminifrenchie6.jpg,"(600, 600)",0.0499210357666015,1.0,"The dog in the image appears to be a French Bulldog, as suggested by the username in the caption on the image. French Bulldogs have distinctive bat-like ears, a short snout, and a muscular, compact body structure, which matches the features of the dog pictured.

Other breeds that could potentially look similar due to some physical features like the size and shape of the head or the muscular body might include:

1. Boston Terrier - Although they usually have a more tuxedo-like black and white coat pattern, they share a similar head structure and body shape.
2. Pug - They have similar compact, muscular bodies and are also a brachycephalic breed with a short muzzle, but their ears are different and they typically have more wrinkles.
3. English Bulldog - They share the muscular stature and the short snout but have a more pronounced wrinkled face and their body is generally more stout with a looser skin.","{'prompt_tokens': 791, 'completion_tokens': 190, 'total_tokens': 981}"
@emmatheminifrenchie7.jpg,"(2048, 1536)",0.4789705276489258,1.3333333333333333,"The dog on the magazine cover in the image you provided resembles a French Bulldog. This breed is identifiable by its bat-like ears, flat face, and compact, muscular body. However, since you asked for three possible breeds, I can suggest other breeds with similar features, although they may not be an exact match:

1. French Bulldog
2. Boston Terrier - They share similar tuxedo markings and have a squarish face and large ears, but the Boston Terrier's ears are generally more upright and pointed.
3. Pug - Pugs have a wrinkled face and a curled tail, though they do not have the large bat ears like a French Bulldog, and their snout is not as flat.

The dog in the image, however, does strongly resemble a classic French Bulldog.","{'prompt_tokens': 791, 'completion_tokens': 166, 'total_tokens': 957}"
