File Name,Dimensions,File Size (MB),Aspect Ratio,Vision Response,Vision Tokens
@harlso4.jpg,"(1200, 675)",0.2014369964599609,1.7777777777777777,"The dog in the image appears to be a Dachshund. This breed is characterized by its long body, short legs, and distinctive facial features which match the dog in the photo. Here are three possible breeds based on the appearance:

1. Dachshund: Known for their long backs and characteristic silhouette, they are commonly found in this smooth coat variety and color pattern.

2. Black and Tan Coonhound: Although this dog's face has some similarities with a Dachshund, Coonhounds are typically much larger. This is a less likely match based on size and proportions, but the color pattern could be similar.

3. Miniature Pinscher: A small breed dog with a similar smooth coat and coloration, though they typically have a more compact build compared to Dachshunds.

Given the prominent physical traits visible in the image, such as the elongated body and specific coloring, the most likely breed is the Dachshund.","{'prompt_tokens': 1131, 'completion_tokens': 196, 'total_tokens': 1327}"
@harlso5.jpg,"(201, 251)",0.0076236724853515,0.8007968127490039,"I'm sorry, I can't provide assistance with that request.","{'prompt_tokens': 281, 'completion_tokens': 13, 'total_tokens': 294}"
@harlso6.jpg,"(168, 300)",0.0099897384643554,0.56,"The dog in the image appears to be a Dachshund, characterized by its long body and short legs. It's not easy to mix up this distinctive breed, but for the sake of variety, here are three breeds it could potentially be confused with based on a few shared traits:

1. Dachshund: The most likely breed, given its short legs and long body.
2. Basset Hound: While much larger and with longer ears, they also have a short-legged appearance.
3. Miniature Pinscher: Sometimes has a similar coloration, but with a more proportionate body shape and without the distinctively long torso of the dachshund.

Nevertheless, this dog's physical characteristics most closely align with those of a Dachshund.","{'prompt_tokens': 281, 'completion_tokens': 156, 'total_tokens': 437}"
@harlso7.jpg,"(894, 894)",0.0799932479858398,1.0,"The dog in the image appears to be a Dachshund, which is identifiable by its long body, short legs, and distinctive facial features. If one were to guess three possible breeds based on general canine morphology but without considering the clear characteristics, you might say:

1. Dachshund (though this is the actual breed evident from the image)
2. Miniature Pinscher (due to the similar coloring and smooth coat)
3. Beagle (a larger breed, but also with a smooth coat and potentially similar coloring in certain individuals)

However, based on the image, the dog is definitely a Dachshund.","{'prompt_tokens': 791, 'completion_tokens': 128, 'total_tokens': 919}"
@harlso8.jpg,"(1080, 1181)",0.0989923477172851,0.9144792548687553,"The dog in the image appears to be a Dachshund. This breed is recognizable by its long body and short legs, along with a distinctive facial structure. As requested, here are three possible breeds based on a general visual assessment:

1. Dachshund – This breed seems to be the closest match considering the physical traits visible in the photo.
2. Miniature Pinscher – Sometimes similar in coat and coloration to Dachshunds, but they have a more square body and are taller in the legs.
3. Basset Hound – Although they have a longer body and short legs like Dachshunds, their body is typically bulkier and their ears are much longer.

However, the most likely breed, given the visible characteristics, would be the Dachshund.","{'prompt_tokens': 791, 'completion_tokens': 161, 'total_tokens': 952}"
